id,title,context,question,answers,text
5726ddf15951b619008f809c,Mali,"Efforts have been made to improve nutrition, and reduce associated health problems, by encouraging women to make nutritious versions of local recipes. For example, the International Crops Research Institute for the Semi-Arid Tropics (ICRISAT) and the Aga Khan Foundation, trained women's groups to make equinut, a healthy and nutritional version of the traditional recipe di-dèguè (comprising peanut paste, honey and millet or rice flour). The aim was to boost nutrition and livelihoods by producing a product that women could make and sell, and which would be accepted by the local community because of its local heritage.",ICRISTAT had success in teaching women how to make what product of nutritional value?,"{'text': ['equinut'], 'answer_start': [303]}","Efforts have been made to improve nutrition, and reduce associated health problems, by encouraging women to make nutritious versions of local recipes. For example, the International Crops Research Institute for the Semi-Arid Tropics (ICRISAT) and the Aga Khan Foundation, trained women's groups to make equinut, a healthy and nutritional version of the traditional recipe di-dèguè (comprising peanut paste, honey and millet or rice flour). The aim was to boost nutrition and livelihoods by producing a product that women could make and sell, and which would be accepted by the local community because of its local heritage. <br> <hr size=""2""> <strong>Question: ICRISTAT had success in teaching women how to make what product of nutritional value?</Strong>"
56d0e08817492d1400aab66e,Buddhism,"Two major extant branches of Buddhism are generally recognized by scholars: Theravada (""The School of the Elders"") and Mahayana (""The Great Vehicle""). Vajrayana, a body of teachings attributed to Indian siddhas, may be viewed as a third branch or merely a part of Mahayana. Theravada has a widespread following in Sri Lanka and Southeast Asia. Mahayana which includes the traditions of Pure Land, Zen, Nichiren Buddhism, Shingon, and Tiantai (Tendai) is found throughout East Asia. Tibetan Buddhism, which preserves the Vajrayana teachings of eighth century India, is practiced in regions surrounding the Himalayas, Mongolia and Kalmykia. Buddhists number between an estimated 488 million[web 1] and 535 million, making it one of the world's major religions.",What minor branch is sometimes attributed to Mahayana?,"{'text': ['Vajrayana'], 'answer_start': [151]}","Two major extant branches of Buddhism are generally recognized by scholars: Theravada (""The School of the Elders"") and Mahayana (""The Great Vehicle""). Vajrayana, a body of teachings attributed to Indian siddhas, may be viewed as a third branch or merely a part of Mahayana. Theravada has a widespread following in Sri Lanka and Southeast Asia. Mahayana which includes the traditions of Pure Land, Zen, Nichiren Buddhism, Shingon, and Tiantai (Tendai) is found throughout East Asia. Tibetan Buddhism, which preserves the Vajrayana teachings of eighth century India, is practiced in regions surrounding the Himalayas, Mongolia and Kalmykia. Buddhists number between an estimated 488 million[web 1] and 535 million, making it one of the world's major religions. <br> <hr size=""2""> <strong>Question: What minor branch is sometimes attributed to Mahayana?</Strong>"
572a496c7a1753140016ae7b,Ottoman_Empire,"However, the collapsing Ottoman economy could not sustain the fleet's strength for too long. Sultan Abdülhamid II distrusted the admirals who sided with the reformist Midhat Pasha, and claimed that the large and expensive fleet was of no use against the Russians during the Russo-Turkish War. He locked most of the fleet inside the Golden Horn, where the ships decayed for the next 30 years. Following the Young Turk Revolution in 1908, the Committee of Union and Progress sought to develop a strong Ottoman naval force. The Ottoman Navy Foundation was established in 1910 to buy new ships through public donations.",When was the Young Turk Revolution?,"{'text': ['1908'], 'answer_start': [431]}","However, the collapsing Ottoman economy could not sustain the fleet's strength for too long. Sultan Abdülhamid II distrusted the admirals who sided with the reformist Midhat Pasha, and claimed that the large and expensive fleet was of no use against the Russians during the Russo-Turkish War. He locked most of the fleet inside the Golden Horn, where the ships decayed for the next 30 years. Following the Young Turk Revolution in 1908, the Committee of Union and Progress sought to develop a strong Ottoman naval force. The Ottoman Navy Foundation was established in 1910 to buy new ships through public donations. <br> <hr size=""2""> <strong>Question: When was the Young Turk Revolution?</Strong>"
572634c8271a42140099d766,Freemasonry,"In contrast to Catholic allegations of rationalism and naturalism, Protestant objections are more likely to be based on allegations of mysticism, occultism, and even Satanism. Masonic scholar Albert Pike is often quoted (in some cases misquoted) by Protestant anti-Masons as an authority for the position of Masonry on these issues. However, Pike, although undoubtedly learned, was not a spokesman for Freemasonry and was also controversial among Freemasons in general. His writings represented his personal opinion only, and furthermore an opinion grounded in the attitudes and understandings of late 19th century Southern Freemasonry of the USA. Notably, his book carries in the preface a form of disclaimer from his own Grand Lodge. No one voice has ever spoken for the whole of Freemasonry.",Who has spoke for all Freemasons?,"{'text': ['No one'], 'answer_start': [736]}","In contrast to Catholic allegations of rationalism and naturalism, Protestant objections are more likely to be based on allegations of mysticism, occultism, and even Satanism. Masonic scholar Albert Pike is often quoted (in some cases misquoted) by Protestant anti-Masons as an authority for the position of Masonry on these issues. However, Pike, although undoubtedly learned, was not a spokesman for Freemasonry and was also controversial among Freemasons in general. His writings represented his personal opinion only, and furthermore an opinion grounded in the attitudes and understandings of late 19th century Southern Freemasonry of the USA. Notably, his book carries in the preface a form of disclaimer from his own Grand Lodge. No one voice has ever spoken for the whole of Freemasonry. <br> <hr size=""2""> <strong>Question: Who has spoke for all Freemasons?</Strong>"
5729a26f3f37b3190047852c,Insect,"Insects play important roles in biological research. For example, because of its small size, short generation time and high fecundity, the common fruit fly Drosophila melanogaster is a model organism for studies in the genetics of higher eukaryotes. D. melanogaster has been an essential part of studies into principles like genetic linkage, interactions between genes, chromosomal genetics, development, behavior and evolution. Because genetic systems are well conserved among eukaryotes, understanding basic cellular processes like DNA replication or transcription in fruit flies can help to understand those processes in other eukaryotes, including humans. The genome of D. melanogaster was sequenced in 2000, reflecting the organism's important role in biological research. It was found that 70% of the fly genome is similar to the human genome, supporting the evolution theory.",What is a common insect used for research purposes?,"{'text': ['fruit fly Drosophila melanogaster'], 'answer_start': [146]}","Insects play important roles in biological research. For example, because of its small size, short generation time and high fecundity, the common fruit fly Drosophila melanogaster is a model organism for studies in the genetics of higher eukaryotes. D. melanogaster has been an essential part of studies into principles like genetic linkage, interactions between genes, chromosomal genetics, development, behavior and evolution. Because genetic systems are well conserved among eukaryotes, understanding basic cellular processes like DNA replication or transcription in fruit flies can help to understand those processes in other eukaryotes, including humans. The genome of D. melanogaster was sequenced in 2000, reflecting the organism's important role in biological research. It was found that 70% of the fly genome is similar to the human genome, supporting the evolution theory. <br> <hr size=""2""> <strong>Question: What is a common insect used for research purposes?</Strong>"
572689fef1498d1400e8e32b,Mexico_City,"The World Bank has sponsored a project to curb air pollution through public transport improvements and the Mexican government has started shutting down polluting factories. They have phased out diesel buses and mandated new emission controls on new cars; since 1993 all new cars must be fitted with a catalytic converter, which reduces the emissions released. Trucks must use only liquefied petroleum gas (LPG). Also construction of an underground rail system was begun in 1968 in order to help curb air pollution problems and alleviate traffic congestion. Today it has over 201 km (125 mi) of track and carries over 5 million people every day. Fees are kept low to encourage use of the system and during rush hours the crush is so great, that authorities have reserved a special carriage specifically for women. Due to these initiatives and others, the air quality in Mexico City has begun to improve, with the air becoming cleaner since 1991, when the air quality was declared to be a public health risk for 355 days of the year.[citation needed]",How many days of the year in 1991 was the air pollution a serious health risk?,"{'text': ['355'], 'answer_start': [1010]}","The World Bank has sponsored a project to curb air pollution through public transport improvements and the Mexican government has started shutting down polluting factories. They have phased out diesel buses and mandated new emission controls on new cars; since 1993 all new cars must be fitted with a catalytic converter, which reduces the emissions released. Trucks must use only liquefied petroleum gas (LPG). Also construction of an underground rail system was begun in 1968 in order to help curb air pollution problems and alleviate traffic congestion. Today it has over 201 km (125 mi) of track and carries over 5 million people every day. Fees are kept low to encourage use of the system and during rush hours the crush is so great, that authorities have reserved a special carriage specifically for women. Due to these initiatives and others, the air quality in Mexico City has begun to improve, with the air becoming cleaner since 1991, when the air quality was declared to be a public health risk for 355 days of the year.[citation needed] <br> <hr size=""2""> <strong>Question: How many days of the year in 1991 was the air pollution a serious health risk?</Strong>"
570cf1b5fed7b91900d45b2d,Macintosh,"In 1982, Regis McKenna was brought in to shape the marketing and launch of the Macintosh. Later the Regis McKenna team grew to include Jane Anderson, Katie Cadigan and Andy Cunningham, who eventually led the Apple account for the agency. Cunningham and Anderson were the primary authors of the Macintosh launch plan. The launch of the Macintosh pioneered many different tactics that are used today in launching technology products, including the ""multiple exclusive,"" event marketing (credited to John Sculley, who brought the concept over from Pepsi), creating a mystique around a product and giving an inside look into a product's creation.",Who was brought in to shape the marketing of Macintosh in 1982?,"{'text': ['Regis McKenna'], 'answer_start': [9]}","In 1982, Regis McKenna was brought in to shape the marketing and launch of the Macintosh. Later the Regis McKenna team grew to include Jane Anderson, Katie Cadigan and Andy Cunningham, who eventually led the Apple account for the agency. Cunningham and Anderson were the primary authors of the Macintosh launch plan. The launch of the Macintosh pioneered many different tactics that are used today in launching technology products, including the ""multiple exclusive,"" event marketing (credited to John Sculley, who brought the concept over from Pepsi), creating a mystique around a product and giving an inside look into a product's creation. <br> <hr size=""2""> <strong>Question: Who was brought in to shape the marketing of Macintosh in 1982?</Strong>"
572766fdf1498d1400e8f779,Botany,"Plant physiology encompasses all the internal chemical and physical activities of plants associated with life. Chemicals obtained from the air, soil and water form the basis of all plant metabolism. The energy of sunlight, captured by oxygenic photosynthesis and released by cellular respiration, is the basis of almost all life. Photoautotrophs, including all green plants, algae and cyanobacteria gather energy directly from sunlight by photosynthesis. Heterotrophs including all animals, all fungi, all completely parasitic plants, and non-photosynthetic bacteria take in organic molecules produced by photoautotrophs and respire them or use them in the construction of cells and tissues. Respiration is the oxidation of carbon compounds by breaking them down into simpler structures to release the energy they contain, essentially the opposite of photosynthesis.",Where do plants get their energy?,"{'text': ['sunlight'], 'answer_start': [213]}","Plant physiology encompasses all the internal chemical and physical activities of plants associated with life. Chemicals obtained from the air, soil and water form the basis of all plant metabolism. The energy of sunlight, captured by oxygenic photosynthesis and released by cellular respiration, is the basis of almost all life. Photoautotrophs, including all green plants, algae and cyanobacteria gather energy directly from sunlight by photosynthesis. Heterotrophs including all animals, all fungi, all completely parasitic plants, and non-photosynthetic bacteria take in organic molecules produced by photoautotrophs and respire them or use them in the construction of cells and tissues. Respiration is the oxidation of carbon compounds by breaking them down into simpler structures to release the energy they contain, essentially the opposite of photosynthesis. <br> <hr size=""2""> <strong>Question: Where do plants get their energy?</Strong>"
57319465497a881900249079,University,"Early Modern universities initially continued the curriculum and research of the Middle Ages: natural philosophy, logic, medicine, theology, mathematics, astronomy (and astrology), law, grammar and rhetoric. Aristotle was prevalent throughout the curriculum, while medicine also depended on Galen and Arabic scholarship. The importance of humanism for changing this state-of-affairs cannot be underestimated. Once humanist professors joined the university faculty, they began to transform the study of grammar and rhetoric through the studia humanitatis. Humanist professors focused on the ability of students to write and speak with distinction, to translate and interpret classical texts, and to live honorable lives. Other scholars within the university were affected by the humanist approaches to learning and their linguistic expertise in relation to ancient texts, as well as the ideology that advocated the ultimate importance of those texts. Professors of medicine such as Niccolò Leoniceno, Thomas Linacre and William Cop were often trained in and taught from a humanist perspective as well as translated important ancient medical texts. The critical mindset imparted by humanism was imperative for changes in universities and scholarship. For instance, Andreas Vesalius was educated in a humanist fashion before producing a translation of Galen, whose ideas he verified through his own dissections. In law, Andreas Alciatus infused the Corpus Juris with a humanist perspective, while Jacques Cujas humanist writings were paramount to his reputation as a jurist. Philipp Melanchthon cited the works of Erasmus as a highly influential guide for connecting theology back to original texts, which was important for the reform at Protestant universities. Galileo Galilei, who taught at the Universities of Pisa and Padua, and Martin Luther, who taught at the University of Wittenberg (as did Melanchthon), also had humanist training. The task of the humanists was to slowly permeate the university; to increase the humanist presence in professorships and chairs, syllabi and textbooks so that published works would demonstrate the humanistic ideal of science and scholarship.",Which individual added a humanist view into the Corpus Juris?,"{'text': ['Andreas Alciatus'], 'answer_start': [1417]}","Early Modern universities initially continued the curriculum and research of the Middle Ages: natural philosophy, logic, medicine, theology, mathematics, astronomy (and astrology), law, grammar and rhetoric. Aristotle was prevalent throughout the curriculum, while medicine also depended on Galen and Arabic scholarship. The importance of humanism for changing this state-of-affairs cannot be underestimated. Once humanist professors joined the university faculty, they began to transform the study of grammar and rhetoric through the studia humanitatis. Humanist professors focused on the ability of students to write and speak with distinction, to translate and interpret classical texts, and to live honorable lives. Other scholars within the university were affected by the humanist approaches to learning and their linguistic expertise in relation to ancient texts, as well as the ideology that advocated the ultimate importance of those texts. Professors of medicine such as Niccolò Leoniceno, Thomas Linacre and William Cop were often trained in and taught from a humanist perspective as well as translated important ancient medical texts. The critical mindset imparted by humanism was imperative for changes in universities and scholarship. For instance, Andreas Vesalius was educated in a humanist fashion before producing a translation of Galen, whose ideas he verified through his own dissections. In law, Andreas Alciatus infused the Corpus Juris with a humanist perspective, while Jacques Cujas humanist writings were paramount to his reputation as a jurist. Philipp Melanchthon cited the works of Erasmus as a highly influential guide for connecting theology back to original texts, which was important for the reform at Protestant universities. Galileo Galilei, who taught at the Universities of Pisa and Padua, and Martin Luther, who taught at the University of Wittenberg (as did Melanchthon), also had humanist training. The task of the humanists was to slowly permeate the university; to increase the humanist presence in professorships and chairs, syllabi and textbooks so that published works would demonstrate the humanistic ideal of science and scholarship. <br> <hr size=""2""> <strong>Question: Which individual added a humanist view into the Corpus Juris?</Strong>"
5726bc5af1498d1400e8e980,Botany,"Plants and various other groups of photosynthetic eukaryotes collectively known as ""algae"" have unique organelles known as chloroplasts. Chloroplasts are thought to be descended from cyanobacteria that formed endosymbiotic relationships with ancient plant and algal ancestors. Chloroplasts and cyanobacteria contain the blue-green pigment chlorophyll a. Chlorophyll a (as well as its plant and green algal-specific cousin chlorophyll b)[a] absorbs light in the blue-violet and orange/red parts of the spectrum while reflecting and transmitting the green light that we see as the characteristic colour of these organisms. The energy in the red and blue light that these pigments absorb is used by chloroplasts to make energy-rich carbon compounds from carbon dioxide and water by oxygenic photosynthesis, a process that generates molecular oxygen (O2) as a by-product.",What organelles are unique to algae?,"{'text': ['chloroplasts'], 'answer_start': [123]}","Plants and various other groups of photosynthetic eukaryotes collectively known as ""algae"" have unique organelles known as chloroplasts. Chloroplasts are thought to be descended from cyanobacteria that formed endosymbiotic relationships with ancient plant and algal ancestors. Chloroplasts and cyanobacteria contain the blue-green pigment chlorophyll a. Chlorophyll a (as well as its plant and green algal-specific cousin chlorophyll b)[a] absorbs light in the blue-violet and orange/red parts of the spectrum while reflecting and transmitting the green light that we see as the characteristic colour of these organisms. The energy in the red and blue light that these pigments absorb is used by chloroplasts to make energy-rich carbon compounds from carbon dioxide and water by oxygenic photosynthesis, a process that generates molecular oxygen (O2) as a by-product. <br> <hr size=""2""> <strong>Question: What organelles are unique to algae?</Strong>"
57321ec20fdd8d15006c67c3,Pacific_War,"The U.S. Navy, by contrast, relied on commerce raiding from the outset. However, the problem of Allied forces surrounded in the Philippines, during the early part of 1942, led to diversion of boats to ""guerrilla submarine"" missions. As well, basing in Australia placed boats under Japanese aerial threat while en route to patrol areas, reducing their effectiveness, and Nimitz relied on submarines for close surveillance of enemy bases. Furthermore, the standard-issue Mark 14 torpedo and its Mark VI exploder both proved defective, problems which were not corrected until September 1943. Worst of all, before the war, an uninformed US Customs officer had seized a copy of the Japanese merchant marine code (called the ""maru code"" in the USN), not knowing that the Office of Naval Intelligence (ONI) had broken it. The Japanese promptly changed it, and the new code was not broken again by OP-20G until 1943.",What did the US Navy rely on?,"{'text': ['commerce raiding'], 'answer_start': [38]}","The U.S. Navy, by contrast, relied on commerce raiding from the outset. However, the problem of Allied forces surrounded in the Philippines, during the early part of 1942, led to diversion of boats to ""guerrilla submarine"" missions. As well, basing in Australia placed boats under Japanese aerial threat while en route to patrol areas, reducing their effectiveness, and Nimitz relied on submarines for close surveillance of enemy bases. Furthermore, the standard-issue Mark 14 torpedo and its Mark VI exploder both proved defective, problems which were not corrected until September 1943. Worst of all, before the war, an uninformed US Customs officer had seized a copy of the Japanese merchant marine code (called the ""maru code"" in the USN), not knowing that the Office of Naval Intelligence (ONI) had broken it. The Japanese promptly changed it, and the new code was not broken again by OP-20G until 1943. <br> <hr size=""2""> <strong>Question: What did the US Navy rely on?</Strong>"
57340c13d058e614000b688c,Portugal,"After years of high increase, the unemployment in Portugal has been in a continuous falling trend since the third quarter of 2014, decreasing from a peak of 17.7% achieved in the early 2013 to a rate of 11.9% in the second quarter of 2015. However, it is high still high compared with what was the normal average Portuguese unemployment rate in the past. In the second quarter of 2008 the unemployment rate was 7.3%, but the rate immediately rose the following period. By December 2009, unemployment had surpassed the 10% mark nationwide in the wake of worldwide events, by 2010, the rate was around 11% and in 2011 it was above 12%.[citation needed] The first quarter of 2013 signified a new unemployment rate record for Portugal, as it reached 17.7%— up from 17% in the previous quarter — and the Government has predicted an 18.5% unemployment rate in 2014. However, in the third quarter of the same year, it has surprisingly declined to a rate of 15.6%. From then on, the unemployment downtrend continued, declining to 13.9% in the second semester of 2014 and to 11.9% in the second quarter of 2015.",To what percentage did the unemployment rate peak at?,"{'text': ['17.7%'], 'answer_start': [157]}","After years of high increase, the unemployment in Portugal has been in a continuous falling trend since the third quarter of 2014, decreasing from a peak of 17.7% achieved in the early 2013 to a rate of 11.9% in the second quarter of 2015. However, it is high still high compared with what was the normal average Portuguese unemployment rate in the past. In the second quarter of 2008 the unemployment rate was 7.3%, but the rate immediately rose the following period. By December 2009, unemployment had surpassed the 10% mark nationwide in the wake of worldwide events, by 2010, the rate was around 11% and in 2011 it was above 12%.[citation needed] The first quarter of 2013 signified a new unemployment rate record for Portugal, as it reached 17.7%— up from 17% in the previous quarter — and the Government has predicted an 18.5% unemployment rate in 2014. However, in the third quarter of the same year, it has surprisingly declined to a rate of 15.6%. From then on, the unemployment downtrend continued, declining to 13.9% in the second semester of 2014 and to 11.9% in the second quarter of 2015. <br> <hr size=""2""> <strong>Question: To what percentage did the unemployment rate peak at?</Strong>"
