id,title,context,question,answers,text
57261d0d38643c19005ad031,Buckingham_Palace,"Investitures, which include the conferring of knighthoods by dubbing with a sword, and other awards take place in the palace's Ballroom, built in 1854. At 36.6 m (120 ft) long, 18 m (59 ft) wide and 13.5 m (44 ft) high, it is the largest room in the palace. It has replaced the throne room in importance and use. During investitures, the Queen stands on the throne dais beneath a giant, domed velvet canopy, known as a shamiana or a baldachin, that was used at the Delhi Durbar in 1911. A military band plays in the musicians' gallery as award recipients approach the Queen and receive their honours, watched by their families and friends.",The Ballroom replaced which other room in terms of importance and use?,"{'text': ['the throne room'], 'answer_start': [274]}","Investitures, which include the conferring of knighthoods by dubbing with a sword, and other awards take place in the palace's Ballroom, built in 1854. At 36.6 m (120 ft) long, 18 m (59 ft) wide and 13.5 m (44 ft) high, it is the largest room in the palace. It has replaced the throne room in importance and use. During investitures, the Queen stands on the throne dais beneath a giant, domed velvet canopy, known as a shamiana or a baldachin, that was used at the Delhi Durbar in 1911. A military band plays in the musicians' gallery as award recipients approach the Queen and receive their honours, watched by their families and friends. <br> <hr size=""2""> <strong>Question: The Ballroom replaced which other room in terms of importance and use?</Strong>"
5733abe2d058e614000b5fe8,Tajikistan,"Two rounds of Soviet purges directed by Moscow (1927–1934 and 1937–1938) resulted in the expulsion of nearly 10,000 people, from all levels of the Communist Party of Tajikistan. Ethnic Russians were sent in to replace those expelled and subsequently Russians dominated party positions at all levels, including the top position of first secretary. Between 1926 and 1959 the proportion of Russians among Tajikistan's population grew from less than 1% to 13%. Bobojon Ghafurov, Tajikistan's First Secretary of the Communist Party of Tajikistan from 1946–1956 was the only Tajikistani politician of significance outside of the country during the Soviet Era. He was followed in office by Tursun Uljabayev (1956–61), Jabbor Rasulov (1961–1982), and Rahmon Nabiyev (1982–1985, 1991–1992).",What did the population of Russians do between 1926-1959?,"{'text': ['grew from less than 1% to 13%'], 'answer_start': [426]}","Two rounds of Soviet purges directed by Moscow (1927–1934 and 1937–1938) resulted in the expulsion of nearly 10,000 people, from all levels of the Communist Party of Tajikistan. Ethnic Russians were sent in to replace those expelled and subsequently Russians dominated party positions at all levels, including the top position of first secretary. Between 1926 and 1959 the proportion of Russians among Tajikistan's population grew from less than 1% to 13%. Bobojon Ghafurov, Tajikistan's First Secretary of the Communist Party of Tajikistan from 1946–1956 was the only Tajikistani politician of significance outside of the country during the Soviet Era. He was followed in office by Tursun Uljabayev (1956–61), Jabbor Rasulov (1961–1982), and Rahmon Nabiyev (1982–1985, 1991–1992). <br> <hr size=""2""> <strong>Question: What did the population of Russians do between 1926-1959?</Strong>"
5ad178f7645df0001a2d1d9a,Military_history_of_the_United_States,"With the emergence of ISIL and its capture of large areas of Iraq and Syria, a number of crises resulted that sparked international attention. ISIL had perpetrated sectarian killings and war crimes in both Iraq and Syria. Gains made in the Iraq war were rolled back as Iraqi army units abandoned their posts. Cities were taken over by the terrorist group which enforced its brand of Sharia law. The kidnapping and decapitation of numerous Western journalists and aid-workers also garnered interest and outrage among Western powers. The US intervened with airstrikes in Iraq over ISIL held territories and assets in August, and in September a coalition of US and Middle Eastern powers initiated a bombing campaign in Syria aimed at degrading and destroying ISIL and Al-Nusra-held territory.",What actions did ISIL take against Eastern journalists and aid workers?,"{'text': [], 'answer_start': []}","With the emergence of ISIL and its capture of large areas of Iraq and Syria, a number of crises resulted that sparked international attention. ISIL had perpetrated sectarian killings and war crimes in both Iraq and Syria. Gains made in the Iraq war were rolled back as Iraqi army units abandoned their posts. Cities were taken over by the terrorist group which enforced its brand of Sharia law. The kidnapping and decapitation of numerous Western journalists and aid-workers also garnered interest and outrage among Western powers. The US intervened with airstrikes in Iraq over ISIL held territories and assets in August, and in September a coalition of US and Middle Eastern powers initiated a bombing campaign in Syria aimed at degrading and destroying ISIL and Al-Nusra-held territory. <br> <hr size=""2""> <strong>Question: What actions did ISIL take against Eastern journalists and aid workers?</Strong>"
5728efe24b864d19001650d3,Samurai,"It should be noted that many samurai forces that were active throughout this period were not deployed to Korea; most importantly, the daimyo Tokugawa Ieyasu carefully kept forces under his command out of the Korean campaigns, and other samurai commanders who were opposed to Hideyoshi's domination of Japan either mulled Hideyoshi's call to invade Korea or contributed a small token force. Most commanders who did opposed or otherwise resisted/resented Hideyoshi ended up as part of the so-called Eastern Army, while commanders loyal to Hideyoshi and his son (a notable exception to this trend was Katō Kiyomasa, who deployed with Tokugawa and the Eastern Army) were largely committed to the Western Army; the two opposing sides (so named for the relative geographical locations of their respective commanders' domains) would later clash, most notably at the Battle of Sekigahara, which was won by Tokugawa Ieyasu and the Eastern Forces, paving the way for the establishment of the Tokugawa Shogunate.",What force were most commanders opposed to the Korea invasion part of?,"{'text': ['Eastern Army'], 'answer_start': [497]}","It should be noted that many samurai forces that were active throughout this period were not deployed to Korea; most importantly, the daimyo Tokugawa Ieyasu carefully kept forces under his command out of the Korean campaigns, and other samurai commanders who were opposed to Hideyoshi's domination of Japan either mulled Hideyoshi's call to invade Korea or contributed a small token force. Most commanders who did opposed or otherwise resisted/resented Hideyoshi ended up as part of the so-called Eastern Army, while commanders loyal to Hideyoshi and his son (a notable exception to this trend was Katō Kiyomasa, who deployed with Tokugawa and the Eastern Army) were largely committed to the Western Army; the two opposing sides (so named for the relative geographical locations of their respective commanders' domains) would later clash, most notably at the Battle of Sekigahara, which was won by Tokugawa Ieyasu and the Eastern Forces, paving the way for the establishment of the Tokugawa Shogunate. <br> <hr size=""2""> <strong>Question: What force were most commanders opposed to the Korea invasion part of?</Strong>"
5723f8090dadf01500fa1fce,Queen_Victoria,"Though queen, as an unmarried young woman Victoria was required by social convention to live with her mother, despite their differences over the Kensington System and her mother's continued reliance on Conroy. Her mother was consigned to a remote apartment in Buckingham Palace, and Victoria often refused to see her. When Victoria complained to Melbourne that her mother's close proximity promised ""torment for many years"", Melbourne sympathised but said it could be avoided by marriage, which Victoria called a ""schocking  [sic] alternative"". She showed interest in Albert's education for the future role he would have to play as her husband, but she resisted attempts to rush her into wedlock.",Whi did Victoria have to live with because she was unmarried?,"{'text': ['her mother'], 'answer_start': [98]}","Though queen, as an unmarried young woman Victoria was required by social convention to live with her mother, despite their differences over the Kensington System and her mother's continued reliance on Conroy. Her mother was consigned to a remote apartment in Buckingham Palace, and Victoria often refused to see her. When Victoria complained to Melbourne that her mother's close proximity promised ""torment for many years"", Melbourne sympathised but said it could be avoided by marriage, which Victoria called a ""schocking  [sic] alternative"". She showed interest in Albert's education for the future role he would have to play as her husband, but she resisted attempts to rush her into wedlock. <br> <hr size=""2""> <strong>Question: Whi did Victoria have to live with because she was unmarried?</Strong>"
572a412f1d0469140077989d,Friedrich_Hayek,"During Hayek's years at the University of Vienna, Carl Menger's work on the explanatory strategy of social science and Friedrich von Wieser's commanding presence in the classroom left a lasting influence on him. Upon the completion of his examinations, Hayek was hired by Ludwig von Mises on the recommendation of Wieser as a specialist for the Austrian government working on the legal and economic details of the Treaty of Saint Germain. Between 1923 and 1924 Hayek worked as a research assistant to Prof. Jeremiah Jenks of New York University, compiling macroeconomic data on the American economy and the operations of the US Federal Reserve.",What was the name of the professor Hayek worked for as a research assistant?,"{'text': ['Jeremiah Jenks'], 'answer_start': [507]}","During Hayek's years at the University of Vienna, Carl Menger's work on the explanatory strategy of social science and Friedrich von Wieser's commanding presence in the classroom left a lasting influence on him. Upon the completion of his examinations, Hayek was hired by Ludwig von Mises on the recommendation of Wieser as a specialist for the Austrian government working on the legal and economic details of the Treaty of Saint Germain. Between 1923 and 1924 Hayek worked as a research assistant to Prof. Jeremiah Jenks of New York University, compiling macroeconomic data on the American economy and the operations of the US Federal Reserve. <br> <hr size=""2""> <strong>Question: What was the name of the professor Hayek worked for as a research assistant?</Strong>"
5acfbc6077cf76001a685b54,Royal_assent,"While royal assent has not been withheld in the United Kingdom since 1708, it has often been withheld in British colonies and former colonies by governors acting on royal instructions. In the United States Declaration of Independence, colonists complained that George III ""has refused his Assent to Laws, the most wholesome and necessary for the public good [and] has forbidden his Governors to pass Laws of immediate and pressing importance, unless suspended in their operation till his Assent should be obtained; and when so suspended, he has utterly neglected to attend to them."" Even after colonies such as Canada, Australia, New Zealand, the Union of South Africa, and Newfoundland were granted responsible government, the British government continued to sometimes advise governors-general on the granting of assent; assent was also occasionally reserved to allow the British government to examine a bill before advising the governor-general.",Which countries were not granted a responsible government?,"{'text': [], 'answer_start': []}","While royal assent has not been withheld in the United Kingdom since 1708, it has often been withheld in British colonies and former colonies by governors acting on royal instructions. In the United States Declaration of Independence, colonists complained that George III ""has refused his Assent to Laws, the most wholesome and necessary for the public good [and] has forbidden his Governors to pass Laws of immediate and pressing importance, unless suspended in their operation till his Assent should be obtained; and when so suspended, he has utterly neglected to attend to them."" Even after colonies such as Canada, Australia, New Zealand, the Union of South Africa, and Newfoundland were granted responsible government, the British government continued to sometimes advise governors-general on the granting of assent; assent was also occasionally reserved to allow the British government to examine a bill before advising the governor-general. <br> <hr size=""2""> <strong>Question: Which countries were not granted a responsible government?</Strong>"
5a5e51b25bc9f4001a75aee5,Hindu_philosophy,"The Mīmāṃsā school has several subschools defined by epistemology. The Prābhākara subschool of Mīmāṃsā considered five epistemically reliable means to gaining knowledge: pratyakṣa (perception), anumāṇa (inference), upamāṇa (comparison and analogy), arthāpatti (postulation, derivation from circumstances), and śabda (word, testimony of past or present reliable experts). The Kumārila Bhaṭṭa sub-school of Mīmāṃsā added sixth to its canon of reliable epistemology - anupalabdi (non-perception, negative/cognitive proof).",How many Mimamsa subschools are not defined by epistemology?,"{'text': [], 'answer_start': []}","The Mīmāṃsā school has several subschools defined by epistemology. The Prābhākara subschool of Mīmāṃsā considered five epistemically reliable means to gaining knowledge: pratyakṣa (perception), anumāṇa (inference), upamāṇa (comparison and analogy), arthāpatti (postulation, derivation from circumstances), and śabda (word, testimony of past or present reliable experts). The Kumārila Bhaṭṭa sub-school of Mīmāṃsā added sixth to its canon of reliable epistemology - anupalabdi (non-perception, negative/cognitive proof). <br> <hr size=""2""> <strong>Question: How many Mimamsa subschools are not defined by epistemology?</Strong>"
56db275ae7c41114004b4e3e,American_Idol,"The final two contestants were Lee DeWyze and Bowersox. DeWyze was declared the winner during the May 26 finale. No new song was used as coronation song this year; instead, the two finalists each released a cover song – DeWyze chose U2's ""Beautiful Day"", and Bowersox chose Patty Griffin's ""Up to the Mountain"". This is the first season where neither finalist achieved significant album sales.",What song did DeWyze cover for his first release?,"{'text': ['Beautiful Day'], 'answer_start': [239]}","The final two contestants were Lee DeWyze and Bowersox. DeWyze was declared the winner during the May 26 finale. No new song was used as coronation song this year; instead, the two finalists each released a cover song – DeWyze chose U2's ""Beautiful Day"", and Bowersox chose Patty Griffin's ""Up to the Mountain"". This is the first season where neither finalist achieved significant album sales. <br> <hr size=""2""> <strong>Question: What song did DeWyze cover for his first release?</Strong>"
