Paper ID,Section,Paragraph ID,Line ID,News URL,News ID,DOI,Unnamed: 7,id,Paper Context,News Context,Paper Finding,News Finding,Dustin,Jiaxin,Similarity score,whether_match,field,text
17535336,1) Mixed-reality version of EarthShake with Mouse Control,27,15,http://www.theepochtimes.com/n3/1354229-why-tablets-cant-replace-real-world-schools/,20,10.1145/2702123.2702397,,prestudy_0,"Why do you think this tower fell first?"" This scenario is repeated for different contrasting cases targeting height, wide base, symmetry and center of mass principles ( Figure 3) . The only difference was that this time in order to shake the table, they had to shake the tablet with their hands instead of pressing the shake button as in Condition 2.","Not only that, but students enjoyed the game more in the mixed-reality conditions. They also determined that simple physical controls like shaking the tablet or pushing the earthquake button did little to improve either learning or enjoyment of the game. ""Mixed-reality games that support physical observation in the real world have a great potential to enhance learning and enjoyment for young children,"" the researchers say.","This scenario is repeated for different contrasting cases targeting height, wide base, symmetry and center of mass principles ( Figure 3) .",They also determined that simple physical controls like shaking the tablet or pushing the earthquake button did little to improve either learning or enjoyment of the game.,False,False,0.5182449818,False,Computer_Science,"{'News': '<span data-toggle=""tooltip"" data-html=""true"" data-placement=""bottom"" title=""Context: Not only that, but students enjoyed the game more in the mixed-reality conditions. They also determined that simple physical controls like shaking the tablet or pushing the earthquake button did little to improve either learning or enjoyment of the game.  Mixed-reality games that support physical observation in the real world have a great potential to enhance learning and enjoyment for young children,  the researchers say."">They also determined that simple physical controls like shaking the tablet or pushing the earthquake button did little to improve either learning or enjoyment of the game.</span>', 'Paper': '<span data-toggle=""tooltip"" data-html=""true"" data-placement=""bottom"" title=""Context: Why do you think this tower fell first?  This scenario is repeated for different contrasting cases targeting height, wide base, symmetry and center of mass principles ( Figure 3) . The only difference was that this time in order to shake the table, they had to shake the tablet with their hands instead of pressing the shake button as in Condition 2."">This scenario is repeated for different contrasting cases targeting height, wide base, symmetry and center of mass principles ( Figure 3) .</span>'}"
61690383,Discussion and Conclusions,18,2,http://www.sciencedaily.com/releases/2013/10/131024182551.htm?utm_source=feedburner&utm_medium=feed&utm_campaign=Feed%3A+sciencedaily+%28ScienceDaily%3A+Latest+Science+News%29,22,10.1177/1080569913501862,,prestudy_1,"Based on the findings, we have made several basic conclusions. Not surprisingly, younger professionals are more accepting of mobile phone use. Interestingly, women are far less accepting of mobile phone use during informal meetings.","With a national sample of more than 550 full-time working professionals, the study reveals what business professionals perceive as acceptable, courteous or rude use of mobile phones in the workplace. The researchers first identified the most common grievances people had about smartphone use among their colleagues, including browsing the Internet and checking text messages. ""Not surprisingly, millennials and younger professionals were more likely to be accepting of smartphone use, but they might be doing themselves a disservice,"" Cardon said.","Not surprisingly, younger professionals are more accepting of mobile phone use.","Not surprisingly, millennials and younger professionals were more likely to be accepting of smartphone use, but they might be doing themselves a disservice, Cardon said.",True,True,0.7631883621,True,Computer_Science,"{'News': '<span data-toggle=""tooltip"" data-html=""true"" data-placement=""bottom"" title=""Context: With a national sample of more than 550 full-time working professionals, the study reveals what business professionals perceive as acceptable, courteous or rude use of mobile phones in the workplace. The researchers first identified the most common grievances people had about smartphone use among their colleagues, including browsing the Internet and checking text messages.  Not surprisingly, millennials and younger professionals were more likely to be accepting of smartphone use, but they might be doing themselves a disservice,  Cardon said."">Not surprisingly, millennials and younger professionals were more likely to be accepting of smartphone use, but they might be doing themselves a disservice, Cardon said.</span>', 'Paper': '<span data-toggle=""tooltip"" data-html=""true"" data-placement=""bottom"" title=""Context: Based on the findings, we have made several basic conclusions. Not surprisingly, younger professionals are more accepting of mobile phone use. Interestingly, women are far less accepting of mobile phone use during informal meetings."">Not surprisingly, younger professionals are more accepting of mobile phone use.</span>'}"
17985920,Conclusions,45,3,http://ct.moreover.com/?a=34297170515&p=1pl&v=1&x=aVyQCHIh9o0JvS5uzKIpiQ,4,10.1007/s10055-018-0346-3,,prestudy_2,"The HMD condition was found to have 8.8% improvement in recall accuracy compared to the desktop condition, and this was found to be statistically significant. This suggests an exciting opportunity for the role of immersive virtual environments in assisting in recall. Given the results of our user study, we believe that virtual memory palaces offer us a fascinating insight into how we may be able to organize and structure large information spaces and navigate them in ways that assist in superior recall.","Photo by John T. C This data is exciting in that it suggests that immersive environments could offer new pathways for improved outcomes in education and high-proficiency training. The researchers found that people remember information better if it is presented to them in a virtual environment. ""This data is exciting in that it suggests that immersive environments could offer new pathways for improved outcomes in education and high-proficiency training,"" says Amitabh Varshney, professor of computer science and dean of the College of Computer, Mathematical, and Natural Sciences at UMD.",This suggests an exciting opportunity for the role of immersive virtual environments in assisting in recall.,The researchers found that people remember information better if it is presented to them in a virtual environment.,False,False,0.7561914921,False,Computer_Science,"{'News': '<span data-toggle=""tooltip"" data-html=""true"" data-placement=""bottom"" title=""Context: Photo by John T. C This data is exciting in that it suggests that immersive environments could offer new pathways for improved outcomes in education and high-proficiency training. The researchers found that people remember information better if it is presented to them in a virtual environment.  This data is exciting in that it suggests that immersive environments could offer new pathways for improved outcomes in education and high-proficiency training,  says Amitabh Varshney, professor of computer science and dean of the College of Computer, Mathematical, and Natural Sciences at UMD."">The researchers found that people remember information better if it is presented to them in a virtual environment.</span>', 'Paper': '<span data-toggle=""tooltip"" data-html=""true"" data-placement=""bottom"" title=""Context: The HMD condition was found to have 8.8% improvement in recall accuracy compared to the desktop condition, and this was found to be statistically significant. This suggests an exciting opportunity for the role of immersive virtual environments in assisting in recall. Given the results of our user study, we believe that virtual memory palaces offer us a fascinating insight into how we may be able to organize and structure large information spaces and navigate them in ways that assist in superior recall."">This suggests an exciting opportunity for the role of immersive virtual environments in assisting in recall.</span>'}"
61690383,Study 2: Nationwide Survey of Working Professionals,17,3,http://www.sciencedaily.com/releases/2013/10/131024182551.htm?utm_source=feedburner&utm_medium=feed&utm_campaign=Feed%3A+sciencedaily+%28ScienceDaily%3A+Latest+Science+News%29,13,10.1177/1080569913501862,,prestudy_3,"Women showed far less acceptance for the use of mobile phones during informal meetings. Also, professionals from the Southwest were less likely to be accepting of mobile phone use during informal meetings. Based on the findings, we have made several basic conclusions.","Similarly, 50 percent of men said it was acceptable to answer a call at a power lunch, compared to 26 percent of women. Despite the casual reputation, professionals from the West Coast were less accepting of mobile phone use in meetings than people from the East Coast. Higher-income professionals had less tolerance for smartphone use in business meetings.","Also, professionals from the Southwest were less likely to be accepting of mobile phone use during informal meetings.","Despite the casual reputation, professionals from the West Coast were less accepting of mobile phone use in meetings than people from the East Coast.",True,True,0.8278610706,True,Computer_Science,"{'News': '<span data-toggle=""tooltip"" data-html=""true"" data-placement=""bottom"" title=""Context: Similarly, 50 percent of men said it was acceptable to answer a call at a power lunch, compared to 26 percent of women. Despite the casual reputation, professionals from the West Coast were less accepting of mobile phone use in meetings than people from the East Coast. Higher-income professionals had less tolerance for smartphone use in business meetings."">Despite the casual reputation, professionals from the West Coast were less accepting of mobile phone use in meetings than people from the East Coast.</span>', 'Paper': '<span data-toggle=""tooltip"" data-html=""true"" data-placement=""bottom"" title=""Context: Women showed far less acceptance for the use of mobile phones during informal meetings. Also, professionals from the Southwest were less likely to be accepting of mobile phone use during informal meetings. Based on the findings, we have made several basic conclusions."">Also, professionals from the Southwest were less likely to be accepting of mobile phone use during informal meetings.</span>'}"
4457804,,13,9,http://www.theepochtimes.com/n3/924144-neurons-reveal-the-brains-learning-limit/,3,10.1038/nature13665,,prestudy_4,"By construction, the intuitive mapping lies within the intrinsic manifold. A within-manifold perturbation was created by re-orienting the intuitive control space but keeping it within the intrinsic manifold (depicted as the red line in Fig. This preserved the relationship between neural units and comodulation patterns, but it altered the way in which co-modulation patterns affected cursor kinematics (red arrows, Fig.","For example, a trained pianist can learn a new melody easier than learning how to hit a tennis serve. As reported in Nature, the researchers found for the first time that there are limitations on how adaptable the brain is during learning and that these restrictions are a key determinant for whether a new skill will be easy or difficult to learn. Understanding how the brain's activity can be ""flexed"" during learning could eventually be used to develop better treatments for stroke and other brain injuries.",A within-manifold perturbation was created by re-orienting the intuitive control space but keeping it within the intrinsic manifold (depicted as the red line in Fig.,"For example, a trained pianist can learn a new melody easier than learning how to hit a tennis serve.",False,False,0.5825967193,False,Computer_Science,"{'News': '<span data-toggle=""tooltip"" data-html=""true"" data-placement=""bottom"" title=""Context: For example, a trained pianist can learn a new melody easier than learning how to hit a tennis serve. As reported in Nature, the researchers found for the first time that there are limitations on how adaptable the brain is during learning and that these restrictions are a key determinant for whether a new skill will be easy or difficult to learn. Understanding how the brain\'s activity can be  flexed  during learning could eventually be used to develop better treatments for stroke and other brain injuries."">For example, a trained pianist can learn a new melody easier than learning how to hit a tennis serve.</span>', 'Paper': '<span data-toggle=""tooltip"" data-html=""true"" data-placement=""bottom"" title=""Context: By construction, the intuitive mapping lies within the intrinsic manifold. A within-manifold perturbation was created by re-orienting the intuitive control space but keeping it within the intrinsic manifold (depicted as the red line in Fig. This preserved the relationship between neural units and comodulation patterns, but it altered the way in which co-modulation patterns affected cursor kinematics (red arrows, Fig."">A within-manifold perturbation was created by re-orienting the intuitive control space but keeping it within the intrinsic manifold (depicted as the red line in Fig.</span>'}"
